<?xml version="1.0" encoding="UTF-8"?>
<!ELEMENT excelConfig (typeHandlers, files)>
<!ELEMENT typeHandlers (typeHandler*)>
<!ELEMENT typeHandler EMPTY>
<!ATTLIST typeHandler
	type  CDATA #REQUIRED
	class CDATA #REQUIRED
	constructParameter CDATA #IMPLIED
>
<!ELEMENT files (file)*>
<!ELEMENT file (sheet)*>
<!ATTLIST file
	name  CDATA #REQUIRED
>
<!ELEMENT sheet (column+)>
<!ATTLIST sheet
	name  CDATA "sheet1"
>
<!ELEMENT column EMPTY>
<!ATTLIST column
	title  CDATA #REQUIRED
	property CDATA #IMPLIED
	reg CDATA #IMPLIED
	type CDATA #IMPLIED
>